No.     Time           Source                Destination           Protocol Length Info
      1 0.000000       127.0.0.1             127.0.0.1             TCP      74     47656 → 443 [SYN] Seq=0 Win=43690 Len=0 MSS=65495 SACK_PERM=1 TSval=8161749 TSecr=0 WS=128

Frame 1: 74 bytes on wire (592 bits), 74 bytes captured (592 bits) on interface 0
    Interface id: 0 (lo)
    Encapsulation type: Ethernet (1)
    Arrival Time: Aug 20, 2014 09:30:57.383084000 EDT
    [Time shift for this packet: 0.000000000 seconds]
    Epoch Time: 1408541457.383084000 seconds
    [Time delta from previous captured frame: 0.000000000 seconds]
    [Time delta from previous displayed frame: 0.000000000 seconds]
    [Time since reference or first frame: 0.000000000 seconds]
    Frame Number: 1
    Frame Length: 74 bytes (592 bits)
    Capture Length: 74 bytes (592 bits)
    [Frame is marked: False]
    [Frame is ignored: False]
    [Protocols in frame: eth:ethertype:ip:tcp]
    [Coloring Rule Name: TCP SYN/FIN]
    [Coloring Rule String: tcp.flags & 0x02 || tcp.flags.fin == 1]
Ethernet II, Src: 00:00:00_00:00:00 (00:00:00:00:00:00), Dst: 00:00:00_00:00:00 (00:00:00:00:00:00)
    Destination: 00:00:00_00:00:00 (00:00:00:00:00:00)
    Source: 00:00:00_00:00:00 (00:00:00:00:00:00)
    Type: IPv4 (0x0800)
Internet Protocol Version 4, Src: 127.0.0.1, Dst: 127.0.0.1
    0100 .... = Version: 4
    .... 0101 = Header Length: 20 bytes
    Differentiated Services Field: 0x00 (DSCP: CS0, ECN: Not-ECT)
    Total Length: 60
    Identification: 0xe74b (59211)
    Flags: 0x02 (Don't Fragment)
    Fragment offset: 0
    Time to live: 64
    Protocol: TCP (6)
    Header checksum: 0x556e [validation disabled]
    Source: 127.0.0.1
    Destination: 127.0.0.1
    [Source GeoIP: Unknown]
    [Destination GeoIP: Unknown]
Transmission Control Protocol, Src Port: 47656 (47656), Dst Port: 443 (443), Seq: 0, Len: 0
    Source Port: 47656
    Destination Port: 443
    [Stream index: 0]
    [TCP Segment Len: 0]
    Sequence number: 0    (relative sequence number)
    Acknowledgment number: 0
    Header Length: 40 bytes
    Flags: 0x002 (SYN)
        000. .... .... = Reserved: Not set
        ...0 .... .... = Nonce: Not set
        .... 0... .... = Congestion Window Reduced (CWR): Not set
        .... .0.. .... = ECN-Echo: Not set
        .... ..0. .... = Urgent: Not set
        .... ...0 .... = Acknowledgment: Not set
        .... .... 0... = Push: Not set
        .... .... .0.. = Reset: Not set
        .... .... ..1. = Syn: Set
            [Expert Info (Chat/Sequence): Connection establish request (SYN): server port 443]
                [Connection establish request (SYN): server port 443]
                [Severity level: Chat]
                [Group: Sequence]
        .... .... ...0 = Fin: Not set
        [TCP Flags: **********S*]
    Window size value: 43690
    [Calculated window size: 43690]
    Checksum: 0xfe30 [validation disabled]
    Urgent pointer: 0
    Options: (20 bytes), Maximum segment size, SACK permitted, Timestamps, No-Operation (NOP), Window scale

No.     Time           Source                Destination           Protocol Length Info
      2 0.000039       127.0.0.1             127.0.0.1             TCP      74     443 → 47656 [SYN, ACK] Seq=0 Ack=1 Win=43690 Len=0 MSS=65495 SACK_PERM=1 TSval=8161749 TSecr=8161749 WS=128

Frame 2: 74 bytes on wire (592 bits), 74 bytes captured (592 bits) on interface 0
    Interface id: 0 (lo)
    Encapsulation type: Ethernet (1)
    Arrival Time: Aug 20, 2014 09:30:57.383123000 EDT
    [Time shift for this packet: 0.000000000 seconds]
    Epoch Time: 1408541457.383123000 seconds
    [Time delta from previous captured frame: 0.000039000 seconds]
    [Time delta from previous displayed frame: 0.000039000 seconds]
    [Time since reference or first frame: 0.000039000 seconds]
    Frame Number: 2
    Frame Length: 74 bytes (592 bits)
    Capture Length: 74 bytes (592 bits)
    [Frame is marked: False]
    [Frame is ignored: False]
    [Protocols in frame: eth:ethertype:ip:tcp]
    [Coloring Rule Name: TCP SYN/FIN]
    [Coloring Rule String: tcp.flags & 0x02 || tcp.flags.fin == 1]
Ethernet II, Src: 00:00:00_00:00:00 (00:00:00:00:00:00), Dst: 00:00:00_00:00:00 (00:00:00:00:00:00)
    Destination: 00:00:00_00:00:00 (00:00:00:00:00:00)
    Source: 00:00:00_00:00:00 (00:00:00:00:00:00)
    Type: IPv4 (0x0800)
Internet Protocol Version 4, Src: 127.0.0.1, Dst: 127.0.0.1
    0100 .... = Version: 4
    .... 0101 = Header Length: 20 bytes
    Differentiated Services Field: 0x00 (DSCP: CS0, ECN: Not-ECT)
    Total Length: 60
    Identification: 0x0000 (0)
    Flags: 0x02 (Don't Fragment)
    Fragment offset: 0
    Time to live: 64
    Protocol: TCP (6)
    Header checksum: 0x3cba [validation disabled]
    Source: 127.0.0.1
    Destination: 127.0.0.1
    [Source GeoIP: Unknown]
    [Destination GeoIP: Unknown]
Transmission Control Protocol, Src Port: 443 (443), Dst Port: 47656 (47656), Seq: 0, Ack: 1, Len: 0
    Source Port: 443
    Destination Port: 47656
    [Stream index: 0]
    [TCP Segment Len: 0]
    Sequence number: 0    (relative sequence number)
    Acknowledgment number: 1    (relative ack number)
    Header Length: 40 bytes
    Flags: 0x012 (SYN, ACK)
        000. .... .... = Reserved: Not set
        ...0 .... .... = Nonce: Not set
        .... 0... .... = Congestion Window Reduced (CWR): Not set
        .... .0.. .... = ECN-Echo: Not set
        .... ..0. .... = Urgent: Not set
        .... ...1 .... = Acknowledgment: Set
        .... .... 0... = Push: Not set
        .... .... .0.. = Reset: Not set
        .... .... ..1. = Syn: Set
            [Expert Info (Chat/Sequence): Connection establish acknowledge (SYN+ACK): server port 443]
                [Connection establish acknowledge (SYN+ACK): server port 443]
                [Severity level: Chat]
                [Group: Sequence]
        .... .... ...0 = Fin: Not set
        [TCP Flags: *******A**S*]
    Window size value: 43690
    [Calculated window size: 43690]
    Checksum: 0xfe30 [validation disabled]
    Urgent pointer: 0
    Options: (20 bytes), Maximum segment size, SACK permitted, Timestamps, No-Operation (NOP), Window scale
    [SEQ/ACK analysis]
        [This is an ACK to the segment in frame: 1]
        [The RTT to ACK the segment was: 0.000039000 seconds]
        [iRTT: 0.000071000 seconds]

No.     Time           Source                Destination           Protocol Length Info
      3 0.000071       127.0.0.1             127.0.0.1             TCP      66     47656 → 443 [ACK] Seq=1 Ack=1 Win=43776 Len=0 TSval=8161749 TSecr=8161749

Frame 3: 66 bytes on wire (528 bits), 66 bytes captured (528 bits) on interface 0
    Interface id: 0 (lo)
    Encapsulation type: Ethernet (1)
    Arrival Time: Aug 20, 2014 09:30:57.383155000 EDT
    [Time shift for this packet: 0.000000000 seconds]
    Epoch Time: 1408541457.383155000 seconds
    [Time delta from previous captured frame: 0.000032000 seconds]
    [Time delta from previous displayed frame: 0.000032000 seconds]
    [Time since reference or first frame: 0.000071000 seconds]
    Frame Number: 3
    Frame Length: 66 bytes (528 bits)
    Capture Length: 66 bytes (528 bits)
    [Frame is marked: False]
    [Frame is ignored: False]
    [Protocols in frame: eth:ethertype:ip:tcp]
    [Coloring Rule Name: TCP]
    [Coloring Rule String: tcp]
Ethernet II, Src: 00:00:00_00:00:00 (00:00:00:00:00:00), Dst: 00:00:00_00:00:00 (00:00:00:00:00:00)
    Destination: 00:00:00_00:00:00 (00:00:00:00:00:00)
    Source: 00:00:00_00:00:00 (00:00:00:00:00:00)
    Type: IPv4 (0x0800)
Internet Protocol Version 4, Src: 127.0.0.1, Dst: 127.0.0.1
    0100 .... = Version: 4
    .... 0101 = Header Length: 20 bytes
    Differentiated Services Field: 0x00 (DSCP: CS0, ECN: Not-ECT)
    Total Length: 52
    Identification: 0xe74c (59212)
    Flags: 0x02 (Don't Fragment)
    Fragment offset: 0
    Time to live: 64
    Protocol: TCP (6)
    Header checksum: 0x5575 [validation disabled]
    Source: 127.0.0.1
    Destination: 127.0.0.1
    [Source GeoIP: Unknown]
    [Destination GeoIP: Unknown]
Transmission Control Protocol, Src Port: 47656 (47656), Dst Port: 443 (443), Seq: 1, Ack: 1, Len: 0
    Source Port: 47656
    Destination Port: 443
    [Stream index: 0]
    [TCP Segment Len: 0]
    Sequence number: 1    (relative sequence number)
    Acknowledgment number: 1    (relative ack number)
    Header Length: 32 bytes
    Flags: 0x010 (ACK)
        000. .... .... = Reserved: Not set
        ...0 .... .... = Nonce: Not set
        .... 0... .... = Congestion Window Reduced (CWR): Not set
        .... .0.. .... = ECN-Echo: Not set
        .... ..0. .... = Urgent: Not set
        .... ...1 .... = Acknowledgment: Set
        .... .... 0... = Push: Not set
        .... .... .0.. = Reset: Not set
        .... .... ..0. = Syn: Not set
        .... .... ...0 = Fin: Not set
        [TCP Flags: *******A****]
    Window size value: 342
    [Calculated window size: 43776]
    [Window size scaling factor: 128]
    Checksum: 0xfe28 [validation disabled]
    Urgent pointer: 0
    Options: (12 bytes), No-Operation (NOP), No-Operation (NOP), Timestamps
    [SEQ/ACK analysis]
        [This is an ACK to the segment in frame: 2]
        [The RTT to ACK the segment was: 0.000032000 seconds]
        [iRTT: 0.000071000 seconds]

No.     Time           Source                Destination           Protocol Length Info
      4 0.000442       127.0.0.1             127.0.0.1             TCP      74     47657 → 443 [SYN] Seq=0 Win=43690 Len=0 MSS=65495 SACK_PERM=1 TSval=8161749 TSecr=0 WS=128

Frame 4: 74 bytes on wire (592 bits), 74 bytes captured (592 bits) on interface 0
    Interface id: 0 (lo)
    Encapsulation type: Ethernet (1)
    Arrival Time: Aug 20, 2014 09:30:57.383526000 EDT
    [Time shift for this packet: 0.000000000 seconds]
    Epoch Time: 1408541457.383526000 seconds
    [Time delta from previous captured frame: 0.000371000 seconds]
    [Time delta from previous displayed frame: 0.000371000 seconds]
    [Time since reference or first frame: 0.000442000 seconds]
    Frame Number: 4
    Frame Length: 74 bytes (592 bits)
    Capture Length: 74 bytes (592 bits)
    [Frame is marked: False]
    [Frame is ignored: False]
    [Protocols in frame: eth:ethertype:ip:tcp]
    [Coloring Rule Name: TCP SYN/FIN]
    [Coloring Rule String: tcp.flags & 0x02 || tcp.flags.fin == 1]
Ethernet II, Src: 00:00:00_00:00:00 (00:00:00:00:00:00), Dst: 00:00:00_00:00:00 (00:00:00:00:00:00)
    Destination: 00:00:00_00:00:00 (00:00:00:00:00:00)
    Source: 00:00:00_00:00:00 (00:00:00:00:00:00)
    Type: IPv4 (0x0800)
Internet Protocol Version 4, Src: 127.0.0.1, Dst: 127.0.0.1
    0100 .... = Version: 4
    .... 0101 = Header Length: 20 bytes
    Differentiated Services Field: 0x00 (DSCP: CS0, ECN: Not-ECT)
    Total Length: 60
    Identification: 0xd825 (55333)
    Flags: 0x02 (Don't Fragment)
    Fragment offset: 0
    Time to live: 64
    Protocol: TCP (6)
    Header checksum: 0x6494 [validation disabled]
    Source: 127.0.0.1
    Destination: 127.0.0.1
    [Source GeoIP: Unknown]
    [Destination GeoIP: Unknown]
Transmission Control Protocol, Src Port: 47657 (47657), Dst Port: 443 (443), Seq: 0, Len: 0
    Source Port: 47657
    Destination Port: 443
    [Stream index: 1]
    [TCP Segment Len: 0]
    Sequence number: 0    (relative sequence number)
    Acknowledgment number: 0
    Header Length: 40 bytes
    Flags: 0x002 (SYN)
        000. .... .... = Reserved: Not set
        ...0 .... .... = Nonce: Not set
        .... 0... .... = Congestion Window Reduced (CWR): Not set
        .... .0.. .... = ECN-Echo: Not set
        .... ..0. .... = Urgent: Not set
        .... ...0 .... = Acknowledgment: Not set
        .... .... 0... = Push: Not set
        .... .... .0.. = Reset: Not set
        .... .... ..1. = Syn: Set
            [Expert Info (Chat/Sequence): Connection establish request (SYN): server port 443]
                [Connection establish request (SYN): server port 443]
                [Severity level: Chat]
                [Group: Sequence]
        .... .... ...0 = Fin: Not set
        [TCP Flags: **********S*]
    Window size value: 43690
    [Calculated window size: 43690]
    Checksum: 0xfe30 [validation disabled]
    Urgent pointer: 0
    Options: (20 bytes), Maximum segment size, SACK permitted, Timestamps, No-Operation (NOP), Window scale

No.     Time           Source                Destination           Protocol Length Info
      5 0.000465       127.0.0.1             127.0.0.1             TCP      74     443 → 47657 [SYN, ACK] Seq=0 Ack=1 Win=43690 Len=0 MSS=65495 SACK_PERM=1 TSval=8161749 TSecr=8161749 WS=128

Frame 5: 74 bytes on wire (592 bits), 74 bytes captured (592 bits) on interface 0
    Interface id: 0 (lo)
    Encapsulation type: Ethernet (1)
    Arrival Time: Aug 20, 2014 09:30:57.383549000 EDT
    [Time shift for this packet: 0.000000000 seconds]
    Epoch Time: 1408541457.383549000 seconds
    [Time delta from previous captured frame: 0.000023000 seconds]
    [Time delta from previous displayed frame: 0.000023000 seconds]
    [Time since reference or first frame: 0.000465000 seconds]
    Frame Number: 5
    Frame Length: 74 bytes (592 bits)
    Capture Length: 74 bytes (592 bits)
    [Frame is marked: False]
    [Frame is ignored: False]
    [Protocols in frame: eth:ethertype:ip:tcp]
    [Coloring Rule Name: TCP SYN/FIN]
    [Coloring Rule String: tcp.flags & 0x02 || tcp.flags.fin == 1]
Ethernet II, Src: 00:00:00_00:00:00 (00:00:00:00:00:00), Dst: 00:00:00_00:00:00 (00:00:00:00:00:00)
    Destination: 00:00:00_00:00:00 (00:00:00:00:00:00)
    Source: 00:00:00_00:00:00 (00:00:00:00:00:00)
    Type: IPv4 (0x0800)
Internet Protocol Version 4, Src: 127.0.0.1, Dst: 127.0.0.1
    0100 .... = Version: 4
    .... 0101 = Header Length: 20 bytes
    Differentiated Services Field: 0x00 (DSCP: CS0, ECN: Not-ECT)
    Total Length: 60
    Identification: 0x0000 (0)
    Flags: 0x02 (Don't Fragment)
    Fragment offset: 0
    Time to live: 64
    Protocol: TCP (6)
    Header checksum: 0x3cba [validation disabled]
    Source: 127.0.0.1
    Destination: 127.0.0.1
    [Source GeoIP: Unknown]
    [Destination GeoIP: Unknown]
Transmission Control Protocol, Src Port: 443 (443), Dst Port: 47657 (47657), Seq: 0, Ack: 1, Len: 0
    Source Port: 443
    Destination Port: 47657
    [Stream index: 1]
    [TCP Segment Len: 0]
    Sequence number: 0    (relative sequence number)
    Acknowledgment number: 1    (relative ack number)
    Header Length: 40 bytes
    Flags: 0x012 (SYN, ACK)
        000. .... .... = Reserved: Not set
        ...0 .... .... = Nonce: Not set
        .... 0... .... = Congestion Window Reduced (CWR): Not set
        .... .0.. .... = ECN-Echo: Not set
        .... ..0. .... = Urgent: Not set
        .... ...1 .... = Acknowledgment: Set
        .... .... 0... = Push: Not set
        .... .... .0.. = Reset: Not set
        .... .... ..1. = Syn: Set
            [Expert Info (Chat/Sequence): Connection establish acknowledge (SYN+ACK): server port 443]
                [Connection establish acknowledge (SYN+ACK): server port 443]
                [Severity level: Chat]
                [Group: Sequence]
        .... .... ...0 = Fin: Not set
        [TCP Flags: *******A**S*]
    Window size value: 43690
    [Calculated window size: 43690]
    Checksum: 0xfe30 [validation disabled]
    Urgent pointer: 0
    Options: (20 bytes), Maximum segment size, SACK permitted, Timestamps, No-Operation (NOP), Window scale
    [SEQ/ACK analysis]
        [This is an ACK to the segment in frame: 4]
        [The RTT to ACK the segment was: 0.000023000 seconds]
        [iRTT: 0.000045000 seconds]

No.     Time           Source                Destination           Protocol Length Info
      6 0.000487       127.0.0.1             127.0.0.1             TCP      66     47657 → 443 [ACK] Seq=1 Ack=1 Win=43776 Len=0 TSval=8161749 TSecr=8161749

Frame 6: 66 bytes on wire (528 bits), 66 bytes captured (528 bits) on interface 0
    Interface id: 0 (lo)
    Encapsulation type: Ethernet (1)
    Arrival Time: Aug 20, 2014 09:30:57.383571000 EDT
    [Time shift for this packet: 0.000000000 seconds]
    Epoch Time: 1408541457.383571000 seconds
    [Time delta from previous captured frame: 0.000022000 seconds]
    [Time delta from previous displayed frame: 0.000022000 seconds]
    [Time since reference or first frame: 0.000487000 seconds]
    Frame Number: 6
    Frame Length: 66 bytes (528 bits)
    Capture Length: 66 bytes (528 bits)
    [Frame is marked: False]
    [Frame is ignored: False]
    [Protocols in frame: eth:ethertype:ip:tcp]
    [Coloring Rule Name: TCP]
    [Coloring Rule String: tcp]
Ethernet II, Src: 00:00:00_00:00:00 (00:00:00:00:00:00), Dst: 00:00:00_00:00:00 (00:00:00:00:00:00)
    Destination: 00:00:00_00:00:00 (00:00:00:00:00:00)
    Source: 00:00:00_00:00:00 (00:00:00:00:00:00)
    Type: IPv4 (0x0800)
Internet Protocol Version 4, Src: 127.0.0.1, Dst: 127.0.0.1
    0100 .... = Version: 4
    .... 0101 = Header Length: 20 bytes
    Differentiated Services Field: 0x00 (DSCP: CS0, ECN: Not-ECT)
    Total Length: 52
    Identification: 0xd826 (55334)
    Flags: 0x02 (Don't Fragment)
    Fragment offset: 0
    Time to live: 64
    Protocol: TCP (6)
    Header checksum: 0x649b [validation disabled]
    Source: 127.0.0.1
    Destination: 127.0.0.1
    [Source GeoIP: Unknown]
    [Destination GeoIP: Unknown]
Transmission Control Protocol, Src Port: 47657 (47657), Dst Port: 443 (443), Seq: 1, Ack: 1, Len: 0
    Source Port: 47657
    Destination Port: 443
    [Stream index: 1]
    [TCP Segment Len: 0]
    Sequence number: 1    (relative sequence number)
    Acknowledgment number: 1    (relative ack number)
    Header Length: 32 bytes
    Flags: 0x010 (ACK)
        000. .... .... = Reserved: Not set
        ...0 .... .... = Nonce: Not set
        .... 0... .... = Congestion Window Reduced (CWR): Not set
        .... .0.. .... = ECN-Echo: Not set
        .... ..0. .... = Urgent: Not set
        .... ...1 .... = Acknowledgment: Set
        .... .... 0... = Push: Not set
        .... .... .0.. = Reset: Not set
        .... .... ..0. = Syn: Not set
        .... .... ...0 = Fin: Not set
        [TCP Flags: *******A****]
    Window size value: 342
    [Calculated window size: 43776]
    [Window size scaling factor: 128]
    Checksum: 0xfe28 [validation disabled]
    Urgent pointer: 0
    Options: (12 bytes), No-Operation (NOP), No-Operation (NOP), Timestamps
    [SEQ/ACK analysis]
        [This is an ACK to the segment in frame: 5]
        [The RTT to ACK the segment was: 0.000022000 seconds]
        [iRTT: 0.000045000 seconds]

No.     Time           Source                Destination           Protocol Length Info
      7 0.000925       127.0.0.1             127.0.0.1             TLSv1.2  253    Client Hello

Frame 7: 253 bytes on wire (2024 bits), 253 bytes captured (2024 bits) on interface 0
    Interface id: 0 (lo)
    Encapsulation type: Ethernet (1)
    Arrival Time: Aug 20, 2014 09:30:57.384009000 EDT
    [Time shift for this packet: 0.000000000 seconds]
    Epoch Time: 1408541457.384009000 seconds
    [Time delta from previous captured frame: 0.000438000 seconds]
    [Time delta from previous displayed frame: 0.000438000 seconds]
    [Time since reference or first frame: 0.000925000 seconds]
    Frame Number: 7
    Frame Length: 253 bytes (2024 bits)
    Capture Length: 253 bytes (2024 bits)
    [Frame is marked: False]
    [Frame is ignored: False]
    [Protocols in frame: eth:ethertype:ip:tcp:ssl]
    [Coloring Rule Name: TCP]
    [Coloring Rule String: tcp]
Ethernet II, Src: 00:00:00_00:00:00 (00:00:00:00:00:00), Dst: 00:00:00_00:00:00 (00:00:00:00:00:00)
    Destination: 00:00:00_00:00:00 (00:00:00:00:00:00)
    Source: 00:00:00_00:00:00 (00:00:00:00:00:00)
    Type: IPv4 (0x0800)
Internet Protocol Version 4, Src: 127.0.0.1, Dst: 127.0.0.1
    0100 .... = Version: 4
    .... 0101 = Header Length: 20 bytes
    Differentiated Services Field: 0x00 (DSCP: CS0, ECN: Not-ECT)
    Total Length: 239
    Identification: 0xe74d (59213)
    Flags: 0x02 (Don't Fragment)
    Fragment offset: 0
    Time to live: 64
    Protocol: TCP (6)
    Header checksum: 0x54b9 [validation disabled]
    Source: 127.0.0.1
    Destination: 127.0.0.1
    [Source GeoIP: Unknown]
    [Destination GeoIP: Unknown]
Transmission Control Protocol, Src Port: 47656 (47656), Dst Port: 443 (443), Seq: 1, Ack: 1, Len: 187
    Source Port: 47656
    Destination Port: 443
    [Stream index: 0]
    [TCP Segment Len: 187]
    Sequence number: 1    (relative sequence number)
    [Next sequence number: 188    (relative sequence number)]
    Acknowledgment number: 1    (relative ack number)
    Header Length: 32 bytes
    Flags: 0x018 (PSH, ACK)
        000. .... .... = Reserved: Not set
        ...0 .... .... = Nonce: Not set
        .... 0... .... = Congestion Window Reduced (CWR): Not set
        .... .0.. .... = ECN-Echo: Not set
        .... ..0. .... = Urgent: Not set
        .... ...1 .... = Acknowledgment: Set
        .... .... 1... = Push: Set
        .... .... .0.. = Reset: Not set
        .... .... ..0. = Syn: Not set
        .... .... ...0 = Fin: Not set
        [TCP Flags: *******AP***]
    Window size value: 342
    [Calculated window size: 43776]
    [Window size scaling factor: 128]
    Checksum: 0xfee3 [validation disabled]
    Urgent pointer: 0
    Options: (12 bytes), No-Operation (NOP), No-Operation (NOP), Timestamps
    [SEQ/ACK analysis]
        [iRTT: 0.000071000 seconds]
        [Bytes in flight: 187]
Secure Sockets Layer

No.     Time           Source                Destination           Protocol Length Info
      8 0.000968       127.0.0.1             127.0.0.1             TCP      66     443 → 47656 [ACK] Seq=1 Ack=188 Win=44800 Len=0 TSval=8161750 TSecr=8161749

Frame 8: 66 bytes on wire (528 bits), 66 bytes captured (528 bits) on interface 0
    Interface id: 0 (lo)
    Encapsulation type: Ethernet (1)
    Arrival Time: Aug 20, 2014 09:30:57.384052000 EDT
    [Time shift for this packet: 0.000000000 seconds]
    Epoch Time: 1408541457.384052000 seconds
    [Time delta from previous captured frame: 0.000043000 seconds]
    [Time delta from previous displayed frame: 0.000043000 seconds]
    [Time since reference or first frame: 0.000968000 seconds]
    Frame Number: 8
    Frame Length: 66 bytes (528 bits)
    Capture Length: 66 bytes (528 bits)
    [Frame is marked: False]
    [Frame is ignored: False]
    [Protocols in frame: eth:ethertype:ip:tcp]
    [Coloring Rule Name: TCP]
    [Coloring Rule String: tcp]
Ethernet II, Src: 00:00:00_00:00:00 (00:00:00:00:00:00), Dst: 00:00:00_00:00:00 (00:00:00:00:00:00)
    Destination: 00:00:00_00:00:00 (00:00:00:00:00:00)
    Source: 00:00:00_00:00:00 (00:00:00:00:00:00)
    Type: IPv4 (0x0800)
Internet Protocol Version 4, Src: 127.0.0.1, Dst: 127.0.0.1
    0100 .... = Version: 4
    .... 0101 = Header Length: 20 bytes
    Differentiated Services Field: 0x00 (DSCP: CS0, ECN: Not-ECT)
    Total Length: 52
    Identification: 0x0d10 (3344)
    Flags: 0x02 (Don't Fragment)
    Fragment offset: 0
    Time to live: 64
    Protocol: TCP (6)
    Header checksum: 0x2fb2 [validation disabled]
    Source: 127.0.0.1
    Destination: 127.0.0.1
    [Source GeoIP: Unknown]
    [Destination GeoIP: Unknown]
Transmission Control Protocol, Src Port: 443 (443), Dst Port: 47656 (47656), Seq: 1, Ack: 188, Len: 0
    Source Port: 443
    Destination Port: 47656
    [Stream index: 0]
    [TCP Segment Len: 0]
    Sequence number: 1    (relative sequence number)
    Acknowledgment number: 188    (relative ack number)
    Header Length: 32 bytes
    Flags: 0x010 (ACK)
        000. .... .... = Reserved: Not set
        ...0 .... .... = Nonce: Not set
        .... 0... .... = Congestion Window Reduced (CWR): Not set
        .... .0.. .... = ECN-Echo: Not set
        .... ..0. .... = Urgent: Not set
        .... ...1 .... = Acknowledgment: Set
        .... .... 0... = Push: Not set
        .... .... .0.. = Reset: Not set
        .... .... ..0. = Syn: Not set
        .... .... ...0 = Fin: Not set
        [TCP Flags: *******A****]
    Window size value: 350
    [Calculated window size: 44800]
    [Window size scaling factor: 128]
    Checksum: 0xfe28 [validation disabled]
    Urgent pointer: 0
    Options: (12 bytes), No-Operation (NOP), No-Operation (NOP), Timestamps
    [SEQ/ACK analysis]
        [This is an ACK to the segment in frame: 7]
        [The RTT to ACK the segment was: 0.000043000 seconds]
        [iRTT: 0.000071000 seconds]

No.     Time           Source                Destination           Protocol Length Info
      9 0.001059       127.0.0.1             127.0.0.1             TLSv1.2  253    Client Hello

Frame 9: 253 bytes on wire (2024 bits), 253 bytes captured (2024 bits) on interface 0
    Interface id: 0 (lo)
    Encapsulation type: Ethernet (1)
    Arrival Time: Aug 20, 2014 09:30:57.384143000 EDT
    [Time shift for this packet: 0.000000000 seconds]
    Epoch Time: 1408541457.384143000 seconds
    [Time delta from previous captured frame: 0.000091000 seconds]
    [Time delta from previous displayed frame: 0.000091000 seconds]
    [Time since reference or first frame: 0.001059000 seconds]
    Frame Number: 9
    Frame Length: 253 bytes (2024 bits)
    Capture Length: 253 bytes (2024 bits)
    [Frame is marked: False]
    [Frame is ignored: False]
    [Protocols in frame: eth:ethertype:ip:tcp:ssl]
    [Coloring Rule Name: TCP]
    [Coloring Rule String: tcp]
Ethernet II, Src: 00:00:00_00:00:00 (00:00:00:00:00:00), Dst: 00:00:00_00:00:00 (00:00:00:00:00:00)
    Destination: 00:00:00_00:00:00 (00:00:00:00:00:00)
    Source: 00:00:00_00:00:00 (00:00:00:00:00:00)
    Type: IPv4 (0x0800)
Internet Protocol Version 4, Src: 127.0.0.1, Dst: 127.0.0.1
    0100 .... = Version: 4
    .... 0101 = Header Length: 20 bytes
    Differentiated Services Field: 0x00 (DSCP: CS0, ECN: Not-ECT)
    Total Length: 239
    Identification: 0xd827 (55335)
    Flags: 0x02 (Don't Fragment)
    Fragment offset: 0
    Time to live: 64
    Protocol: TCP (6)
    Header checksum: 0x63df [validation disabled]
    Source: 127.0.0.1
    Destination: 127.0.0.1
    [Source GeoIP: Unknown]
    [Destination GeoIP: Unknown]
Transmission Control Protocol, Src Port: 47657 (47657), Dst Port: 443 (443), Seq: 1, Ack: 1, Len: 187
    Source Port: 47657
    Destination Port: 443
    [Stream index: 1]
    [TCP Segment Len: 187]
    Sequence number: 1    (relative sequence number)
    [Next sequence number: 188    (relative sequence number)]
    Acknowledgment number: 1    (relative ack number)
    Header Length: 32 bytes
    Flags: 0x018 (PSH, ACK)
        000. .... .... = Reserved: Not set
        ...0 .... .... = Nonce: Not set
        .... 0... .... = Congestion Window Reduced (CWR): Not set
        .... .0.. .... = ECN-Echo: Not set
        .... ..0. .... = Urgent: Not set
        .... ...1 .... = Acknowledgment: Set
        .... .... 1... = Push: Set
        .... .... .0.. = Reset: Not set
        .... .... ..0. = Syn: Not set
        .... .... ...0 = Fin: Not set
        [TCP Flags: *******AP***]
    Window size value: 342
    [Calculated window size: 43776]
    [Window size scaling factor: 128]
    Checksum: 0xfee3 [validation disabled]
    Urgent pointer: 0
    Options: (12 bytes), No-Operation (NOP), No-Operation (NOP), Timestamps
    [SEQ/ACK analysis]
        [iRTT: 0.000045000 seconds]
        [Bytes in flight: 187]
Secure Sockets Layer

No.     Time           Source                Destination           Protocol Length Info
     10 0.001076       127.0.0.1             127.0.0.1             TCP      66     443 → 47657 [ACK] Seq=1 Ack=188 Win=44800 Len=0 TSval=8161750 TSecr=8161750

Frame 10: 66 bytes on wire (528 bits), 66 bytes captured (528 bits) on interface 0
    Interface id: 0 (lo)
    Encapsulation type: Ethernet (1)
    Arrival Time: Aug 20, 2014 09:30:57.384160000 EDT
    [Time shift for this packet: 0.000000000 seconds]
    Epoch Time: 1408541457.384160000 seconds
    [Time delta from previous captured frame: 0.000017000 seconds]
    [Time delta from previous displayed frame: 0.000017000 seconds]
    [Time since reference or first frame: 0.001076000 seconds]
    Frame Number: 10
    Frame Length: 66 bytes (528 bits)
    Capture Length: 66 bytes (528 bits)
    [Frame is marked: False]
    [Frame is ignored: False]
    [Protocols in frame: eth:ethertype:ip:tcp]
    [Coloring Rule Name: TCP]
    [Coloring Rule String: tcp]
Ethernet II, Src: 00:00:00_00:00:00 (00:00:00:00:00:00), Dst: 00:00:00_00:00:00 (00:00:00:00:00:00)
    Destination: 00:00:00_00:00:00 (00:00:00:00:00:00)
    Source: 00:00:00_00:00:00 (00:00:00:00:00:00)
    Type: IPv4 (0x0800)
Internet Protocol Version 4, Src: 127.0.0.1, Dst: 127.0.0.1
    0100 .... = Version: 4
    .... 0101 = Header Length: 20 bytes
    Differentiated Services Field: 0x00 (DSCP: CS0, ECN: Not-ECT)
    Total Length: 52
    Identification: 0x3c60 (15456)
    Flags: 0x02 (Don't Fragment)
    Fragment offset: 0
    Time to live: 64
    Protocol: TCP (6)
    Header checksum: 0x0062 [validation disabled]
    Source: 127.0.0.1
    Destination: 127.0.0.1
    [Source GeoIP: Unknown]
    [Destination GeoIP: Unknown]
Transmission Control Protocol, Src Port: 443 (443), Dst Port: 47657 (47657), Seq: 1, Ack: 188, Len: 0
    Source Port: 443
    Destination Port: 47657
    [Stream index: 1]
    [TCP Segment Len: 0]
    Sequence number: 1    (relative sequence number)
    Acknowledgment number: 188    (relative ack number)
    Header Length: 32 bytes
    Flags: 0x010 (ACK)
        000. .... .... = Reserved: Not set
        ...0 .... .... = Nonce: Not set
        .... 0... .... = Congestion Window Reduced (CWR): Not set
        .... .0.. .... = ECN-Echo: Not set
        .... ..0. .... = Urgent: Not set
        .... ...1 .... = Acknowledgment: Set
        .... .... 0... = Push: Not set
        .... .... .0.. = Reset: Not set
        .... .... ..0. = Syn: Not set
        .... .... ...0 = Fin: Not set
        [TCP Flags: *******A****]
    Window size value: 350
    [Calculated window size: 44800]
    [Window size scaling factor: 128]
    Checksum: 0xfe28 [validation disabled]
    Urgent pointer: 0
    Options: (12 bytes), No-Operation (NOP), No-Operation (NOP), Timestamps
    [SEQ/ACK analysis]
        [This is an ACK to the segment in frame: 9]
        [The RTT to ACK the segment was: 0.000017000 seconds]
        [iRTT: 0.000045000 seconds]

No.     Time           Source                Destination           Protocol Length Info
     11 0.001137       127.0.0.1             127.0.0.1             TLSv1.2  746    Server Hello, Certificate, Server Hello Done

Frame 11: 746 bytes on wire (5968 bits), 746 bytes captured (5968 bits) on interface 0
    Interface id: 0 (lo)
    Encapsulation type: Ethernet (1)
    Arrival Time: Aug 20, 2014 09:30:57.384221000 EDT
    [Time shift for this packet: 0.000000000 seconds]
    Epoch Time: 1408541457.384221000 seconds
    [Time delta from previous captured frame: 0.000061000 seconds]
    [Time delta from previous displayed frame: 0.000061000 seconds]
    [Time since reference or first frame: 0.001137000 seconds]
    Frame Number: 11
    Frame Length: 746 bytes (5968 bits)
    Capture Length: 746 bytes (5968 bits)
    [Frame is marked: False]
    [Frame is ignored: False]
    [Protocols in frame: eth:ethertype:ip:tcp:ssl:pkcs-1:x509sat:x509sat:x509sat:x509sat:x509sat:x509sat:pkcs-1:x509ce:x509ce:x509ce:pkcs-1]
    [Coloring Rule Name: TCP]
    [Coloring Rule String: tcp]
Ethernet II, Src: 00:00:00_00:00:00 (00:00:00:00:00:00), Dst: 00:00:00_00:00:00 (00:00:00:00:00:00)
    Destination: 00:00:00_00:00:00 (00:00:00:00:00:00)
    Source: 00:00:00_00:00:00 (00:00:00:00:00:00)
    Type: IPv4 (0x0800)
Internet Protocol Version 4, Src: 127.0.0.1, Dst: 127.0.0.1
    0100 .... = Version: 4
    .... 0101 = Header Length: 20 bytes
    Differentiated Services Field: 0x00 (DSCP: CS0, ECN: Not-ECT)
    Total Length: 732
    Identification: 0x0d11 (3345)
    Flags: 0x02 (Don't Fragment)
    Fragment offset: 0
    Time to live: 64
    Protocol: TCP (6)
    Header checksum: 0x2d09 [validation disabled]
    Source: 127.0.0.1
    Destination: 127.0.0.1
    [Source GeoIP: Unknown]
    [Destination GeoIP: Unknown]
Transmission Control Protocol, Src Port: 443 (443), Dst Port: 47656 (47656), Seq: 1, Ack: 188, Len: 680
    Source Port: 443
    Destination Port: 47656
    [Stream index: 0]
    [TCP Segment Len: 680]
    Sequence number: 1    (relative sequence number)
    [Next sequence number: 681    (relative sequence number)]
    Acknowledgment number: 188    (relative ack number)
    Header Length: 32 bytes
    Flags: 0x018 (PSH, ACK)
        000. .... .... = Reserved: Not set
        ...0 .... .... = Nonce: Not set
        .... 0... .... = Congestion Window Reduced (CWR): Not set
        .... .0.. .... = ECN-Echo: Not set
        .... ..0. .... = Urgent: Not set
        .... ...1 .... = Acknowledgment: Set
        .... .... 1... = Push: Set
        .... .... .0.. = Reset: Not set
        .... .... ..0. = Syn: Not set
        .... .... ...0 = Fin: Not set
        [TCP Flags: *******AP***]
    Window size value: 350
    [Calculated window size: 44800]
    [Window size scaling factor: 128]
    Checksum: 0x00d1 [validation disabled]
    Urgent pointer: 0
    Options: (12 bytes), No-Operation (NOP), No-Operation (NOP), Timestamps
    [SEQ/ACK analysis]
        [iRTT: 0.000071000 seconds]
        [Bytes in flight: 680]
Secure Sockets Layer

No.     Time           Source                Destination           Protocol Length Info
     12 0.001149       127.0.0.1             127.0.0.1             TCP      66     47656 → 443 [ACK] Seq=188 Ack=681 Win=45056 Len=0 TSval=8161750 TSecr=8161750

Frame 12: 66 bytes on wire (528 bits), 66 bytes captured (528 bits) on interface 0
    Interface id: 0 (lo)
    Encapsulation type: Ethernet (1)
    Arrival Time: Aug 20, 2014 09:30:57.384233000 EDT
    [Time shift for this packet: 0.000000000 seconds]
    Epoch Time: 1408541457.384233000 seconds
    [Time delta from previous captured frame: 0.000012000 seconds]
    [Time delta from previous displayed frame: 0.000012000 seconds]
    [Time since reference or first frame: 0.001149000 seconds]
    Frame Number: 12
    Frame Length: 66 bytes (528 bits)
    Capture Length: 66 bytes (528 bits)
    [Frame is marked: False]
    [Frame is ignored: False]
    [Protocols in frame: eth:ethertype:ip:tcp]
    [Coloring Rule Name: TCP]
    [Coloring Rule String: tcp]
Ethernet II, Src: 00:00:00_00:00:00 (00:00:00:00:00:00), Dst: 00:00:00_00:00:00 (00:00:00:00:00:00)
    Destination: 00:00:00_00:00:00 (00:00:00:00:00:00)
    Source: 00:00:00_00:00:00 (00:00:00:00:00:00)
    Type: IPv4 (0x0800)
Internet Protocol Version 4, Src: 127.0.0.1, Dst: 127.0.0.1
    0100 .... = Version: 4
    .... 0101 = Header Length: 20 bytes
    Differentiated Services Field: 0x00 (DSCP: CS0, ECN: Not-ECT)
    Total Length: 52
    Identification: 0xe74e (59214)
    Flags: 0x02 (Don't Fragment)
    Fragment offset: 0
    Time to live: 64
    Protocol: TCP (6)
    Header checksum: 0x5573 [validation disabled]
    Source: 127.0.0.1
    Destination: 127.0.0.1
    [Source GeoIP: Unknown]
    [Destination GeoIP: Unknown]
Transmission Control Protocol, Src Port: 47656 (47656), Dst Port: 443 (443), Seq: 188, Ack: 681, Len: 0
    Source Port: 47656
    Destination Port: 443
    [Stream index: 0]
    [TCP Segment Len: 0]
    Sequence number: 188    (relative sequence number)
    Acknowledgment number: 681    (relative ack number)
    Header Length: 32 bytes
    Flags: 0x010 (ACK)
        000. .... .... = Reserved: Not set
        ...0 .... .... = Nonce: Not set
        .... 0... .... = Congestion Window Reduced (CWR): Not set
        .... .0.. .... = ECN-Echo: Not set
        .... ..0. .... = Urgent: Not set
        .... ...1 .... = Acknowledgment: Set
        .... .... 0... = Push: Not set
        .... .... .0.. = Reset: Not set
        .... .... ..0. = Syn: Not set
        .... .... ...0 = Fin: Not set
        [TCP Flags: *******A****]
    Window size value: 352
    [Calculated window size: 45056]
    [Window size scaling factor: 128]
    Checksum: 0xfe28 [validation disabled]
    Urgent pointer: 0
    Options: (12 bytes), No-Operation (NOP), No-Operation (NOP), Timestamps
    [SEQ/ACK analysis]
        [This is an ACK to the segment in frame: 11]
        [The RTT to ACK the segment was: 0.000012000 seconds]
        [iRTT: 0.000071000 seconds]

No.     Time           Source                Destination           Protocol Length Info
     13 0.005004       127.0.0.1             127.0.0.1             TLSv1.2  252    Client Key Exchange, Change Cipher Spec, Finished

Frame 13: 252 bytes on wire (2016 bits), 252 bytes captured (2016 bits) on interface 0
    Interface id: 0 (lo)
    Encapsulation type: Ethernet (1)
    Arrival Time: Aug 20, 2014 09:30:57.388088000 EDT
    [Time shift for this packet: 0.000000000 seconds]
    Epoch Time: 1408541457.388088000 seconds
    [Time delta from previous captured frame: 0.003855000 seconds]
    [Time delta from previous displayed frame: 0.003855000 seconds]
    [Time since reference or first frame: 0.005004000 seconds]
    Frame Number: 13
    Frame Length: 252 bytes (2016 bits)
    Capture Length: 252 bytes (2016 bits)
    [Frame is marked: False]
    [Frame is ignored: False]
    [Protocols in frame: eth:ethertype:ip:tcp:ssl]
    [Coloring Rule Name: TCP]
    [Coloring Rule String: tcp]
Ethernet II, Src: 00:00:00_00:00:00 (00:00:00:00:00:00), Dst: 00:00:00_00:00:00 (00:00:00:00:00:00)
    Destination: 00:00:00_00:00:00 (00:00:00:00:00:00)
    Source: 00:00:00_00:00:00 (00:00:00:00:00:00)
    Type: IPv4 (0x0800)
Internet Protocol Version 4, Src: 127.0.0.1, Dst: 127.0.0.1
    0100 .... = Version: 4
    .... 0101 = Header Length: 20 bytes
    Differentiated Services Field: 0x00 (DSCP: CS0, ECN: Not-ECT)
    Total Length: 238
    Identification: 0xe74f (59215)
    Flags: 0x02 (Don't Fragment)
    Fragment offset: 0
    Time to live: 64
    Protocol: TCP (6)
    Header checksum: 0x54b8 [validation disabled]
    Source: 127.0.0.1
    Destination: 127.0.0.1
    [Source GeoIP: Unknown]
    [Destination GeoIP: Unknown]
Transmission Control Protocol, Src Port: 47656 (47656), Dst Port: 443 (443), Seq: 188, Ack: 681, Len: 186
    Source Port: 47656
    Destination Port: 443
    [Stream index: 0]
    [TCP Segment Len: 186]
    Sequence number: 188    (relative sequence number)
    [Next sequence number: 374    (relative sequence number)]
    Acknowledgment number: 681    (relative ack number)
    Header Length: 32 bytes
    Flags: 0x018 (PSH, ACK)
        000. .... .... = Reserved: Not set
        ...0 .... .... = Nonce: Not set
        .... 0... .... = Congestion Window Reduced (CWR): Not set
        .... .0.. .... = ECN-Echo: Not set
        .... ..0. .... = Urgent: Not set
        .... ...1 .... = Acknowledgment: Set
        .... .... 1... = Push: Set
        .... .... .0.. = Reset: Not set
        .... .... ..0. = Syn: Not set
        .... .... ...0 = Fin: Not set
        [TCP Flags: *******AP***]
    Window size value: 352
    [Calculated window size: 45056]
    [Window size scaling factor: 128]
    Checksum: 0xfee2 [validation disabled]
    Urgent pointer: 0
    Options: (12 bytes), No-Operation (NOP), No-Operation (NOP), Timestamps
    [SEQ/ACK analysis]
        [iRTT: 0.000071000 seconds]
        [Bytes in flight: 186]
Secure Sockets Layer

No.     Time           Source                Destination           Protocol Length Info
     14 0.005676       127.0.0.1             127.0.0.1             TLSv1.2  288    New Session Ticket, Change Cipher Spec, Finished

Frame 14: 288 bytes on wire (2304 bits), 288 bytes captured (2304 bits) on interface 0
    Interface id: 0 (lo)
    Encapsulation type: Ethernet (1)
